{
  "id": "11111111-1111-4111-8111-111111111111",
  "firstName": "Jean",
  "lastName": "Dupont",
  "email": "jean.dupont@example.com",
  "phone": "+33612345678",
  "gender": "homme",
  "birthDate": "15/05/1990",
  "height": 178.5,
  "teamIds": ["TEAM-001", "TEAM-002"],
  "statistics": {
    "matchesPlayed": 42,
    "goalsScored": 15,
    "assists": 8,
    "wins": 28,
    "losses": 8,
    "draws": 6,
    "mvps": 5
  },
  "status": "actif",
  "createdAt": "2024-01-15T10:30:00Z",
  "updatedAt": "2024-03-20T15:30:00Z"
}
